expression,context,category
более того,"БОЛЕЕ ТОГО, ЕС не намерен ограничиваться введенными ранее санкциями.",parenth
на мой взгляд,"НА МОЙ ВЗГЛЯД, если уж говорить, что он ""странный"", то он, скорее, ""странный польский"".",parenth
в принципе,"В ПРИНЦИПЕ это не очень существенная сумма для такой большой экономики, как американская, ВВП которой исчисляется в 10 триллионов долларов в год.",parenth
конечно же,"Поэтому и пистолет ― КОНЕЧНО ЖЕ, с умыслом брошенный, намеренно оставленный ― спрятала, и сбежала…",parenth
мне казалось,"МНЕ КАЗАЛОСЬ, философией он разговор о Ли-Ли оттягивает, а оттягивают обычно только самое худшее.",parenth
как говорится,"КАК ГОВОРИТСЯ, задержка пока только в соображении.",parenth
надо сказать,"НАДО СКАЗАТЬ, что с боевым кличем «Богородица! Помогай!» войско тогда ходило в атаку.",parenth
дай бог,"ДАЙ БОГ, чтобы мы встретились с тобой еще раз на небесах…",parenth
так или иначе,"ТАК ИЛИ ИНАЧЕ, он не сказал того единственного слова, и кто знает, может, и к лучшему. А может, и нет.",parenth
если хотите,"Она лишь еще одно доказательство тому, что я из другой жизни, с другой планеты. ЕСЛИ ХОТИТЕ, ее уже нет.",parenth
ради бога,"РАДИ БОГА, оставьте в покое мою бедную голову.",parenth
что называется,"ЧТО НАЗЫВАЕТСЯ, не в службу, а в дружбу.",parenth
без сомнения,"БЕЗ СОМНЕНИЯ, румыны отважились на подобные провокации не без поддержки Киевской рады.",parenth
с моей точки зрения,"С МОЕЙ ТОЧКИ ЗРЕНИЯ… я бы говорила о фатализме, этакий легкий фатализм.",parenth
иными словами,"ИНЫМИ СЛОВАМИ, держава Миндовга началась как крепнущая, присоединяющая к себе литовские земли, уже частично колонизованные, а затем и не тронутые колонизацией.",parenth
к слову,"К СЛОВУ, я учитель истории.",parenth
судя по всему,"СУДЯ ПО ВСЕМУ, поговорить полковник любил, к тому же имел уйму времени.",parenth
нечего делать,"— Сам знаешь, не моя воля: велят идти против тебя — пойду, нечего делать.",parenth
как видите,"КАК ВИДИТЕ, случаем, — неуверенно выдавил из себя Демидович, с натугой натягивая гамашу.",parenth
собственно говоря,"СОБСТВЕННО ГОВОРЯ, его бдительность возбудил офицер в форме капитана французской армии.",parenth
как бы то ни было,"КАК БЫ ТО НИ БЫЛО, большие и малые сражения шли с переменным успехом.",parenth
черт возьми,"ЧЕРТ ВОЗЬМИ, похоже на правду, иначе этот авантюрист не явился бы сюда с одним ординарцем и не вел бы себя так нагло.",parenth
другими словами,"ДРУГИМИ СЛОВАМИ, Миндовг изгнал их на верную смерть.",parenth
по всей вероятности,"Н-6813 меньше земли, и ноблов, ПО ВСЕЙ ВЕРОЯТНОСТИ, меньше, чем нас.",parenth
не дай бог,"Эвакуация… НЕ ДАЙ БОГ! ― значит, такое дело…",parenth
может оказаться,"МОЖЕТ ОКАЗАТЬСЯ и неприбыльно, попробовал прикинуться иначе.",parenth
надо думать,"Ответ, НАДО ДУМАТЬ, был написан втайне от Трайбера: ни «свободной Европы», ни «освобожденной Вайсрутении» там не было.",parenth
как выяснилось,"Деньги, КАК ВЫЯСНИЛОСЬ, были потрачены на приобретение наркотических средств.",parenth
честно говоря,"ЧЕСТНО ГОВОРЯ, я тоже немного соскучился по кухне…",parenth
по слухам,"А может, это волк-людоед, которых, ПО СЛУХАМ, много развелось в окрестных пущах.",parenth
надо полагать,"НАДО ПОЛАГАТЬ, это Лизу порадует.",parenth
как водится,"Много было у него друзей, но и враги, КАК ВОДИТСЯ, имелись.",parenth
как бы,Татьяна Шелегович КАК БЫ подвела итог общего настроения.,part
все же,"И меня поразило, что даже у сельских мужиков, в междусобоях простых и грубых, к женщинам ВСЕ ЖЕ особое отношение.",part
еще и,"За словом «мистификация» часто кроется ЕЩЕ И примитивная, лживая и бессмысленная авантюра.",part
что ли,"Ты же сам говорил. Не помнишь, ЧТО ЛИ?",part
к тому же,"Многих экзотических животных сложно отыскать, К ТОМУ ЖЕ в парках иногда налагаются ограничения на фотографирование в коммерческих целях.",part
вряд ли,Так что ВРЯД ЛИ доподлинную правду сказал Д'артаньяну Атос.,part
не то что,"Их не было, насколько я смог заметить, и в спальне, да НЕ ТО ЧТО книжных полок ― нигде книги ни одной.",part
вроде бы,"Возле досок ВРОДЕ БЫ нормально, а рядом с заготовленными метлами зашкаливает.",part
едва ли не,"Однако в рассказах дядьки Захары, ЕДВА ЛИ НЕ сказочно отдаленных по месту и времени действия, слушатели ловили и воспринимали прежде всего смешное.",part
едва не,"ЕДВА НЕ прыгали от радости, когда ""Песняры"" распадались.",part
не иначе,"Но НЕ ИНАЧЕ бесы преподнесли братьям хитроумный совет обойти дрвенцу сушей, за что поляки заплатили им, бесам, сожжением Гильгенбурга и мордованьем христиан, о чем в ближайший час горько пожалеют.",part
ничего подобного,Никто раньше мне НИЧЕГО ПОДОБНОГО не рассказывал.,part
не то чтобы,"НE ТО, ЧТОБЫ мне хотелось плакать, но так оно получается.",part
не иначе как,И нащупал тут Миколкин отец НЕ ИНАЧЕ КАК налима.,part
вроде как,"Хотя Едигей и не думал, получился ВРОДЕ КАК бы маленький траурный митинг.",part
почти что,"Она понимала, когда на это решались взрослые ― окруженцы и свои мужики, но что там могло привлечь их, ПОЧТИ ЧТО детей, едва оперившихся в жизни подростков?",part
да ладно,"ДА ЛАДНО, Богдан. Знаю я, что ты скажешь.",part
именно что,"Вот ИМЕННО, ЧТО лучше. И если мне не скажешь, то ответишь перед комендантом.",part
никак нет,"НИКАК НЕТ, товарищ капитан.",part
всего-навсего,"Это было уже и не болотце, а ВСЕГО-НАВСЕГО крохотное старое окно под старым пнем.",part
нет-нет да,"Вячка НЕТ-НЕТ ДА ловил влюбленные взгляды, которые князь Всеволод, суровый грубоватый воин, бросал на свою красавицу-жену.",part
все ж таки,"Но ВСЕ Ж ТАКИ… он ожидал услышать ее голос — знал, тогда начинается день, она приносит харч, поддерживает в нем жизнь и тоненькой ниточкой связывает его с миром и бездной событий, из которых выпал он.",part
вот то-то,"В том числе капитана Волоха. ― ВОТ ТО-ТО, лейтенант…",part
ан нет,"Кажется, панацея, спасение для всех людей, АН НЕТ. Потому что такой человек, застрахованный от всех змеиных ядов, неминуемо умирает от первого же укуса обычной пчелы.",part
как бы не так,"КАК БЫ НЕ ТАК, ― сказал он и нетерпеливо высвободился.",part
поди ж ты,"ПОДИ Ж ТЫ, вырвалась с завода, догнала. Уж на что он быстро бежал в гору, а вот не отстала.",part
не так чтобы,"НЕ ТАК ЧТОБЫ близко, но и не очень далеко.",part
вместе с,"ВМЕСТЕ С Беларусью во втором полуфинале выступят также Сербия, Македония, Нидерланды, Мальта, Португалия, Украина, Болгария, Словения, Хорватия, Швеция.",prep
несмотря на,"Они были осуждены, НЕСМОТРЯ НА серьезные сомнения по поводу их роли в этом трагическом событии.",prep
в конце,"Он помогал картеру в мировой дипломатии, например, в нормализации американо-китайских отношений В КОНЦЕ 1970-х годов.",prep
рядом с,Я представил себя РЯДОМ С ней в больничном халате и шлепках.,prep
в качестве,Сфинкс выступает В КАЧЕСТВЕ фона и рассказчика длинной истории.,prep
в виде,"На всей территории зимние, а в Арктике и летние осадки выпадают в виде снега.",prep
со стороны,"В официальном заявлении глава комитета обращает внимание на то, что подобные нарушения СО СТОРОНЫ властей не являются единичными.",prep
с помощью,"В неловкой, обезьяньей позе, С ПОМОЩЬЮ рук Валера одолел добрый отрезок трубы, а вчерашнего стыка все не было, и это стало его пугать не на шутку.",prep
по поводу,В свою очередь начальник отдела информации и связей с общественностью ― пресс-секретарь Минприроды Елена Пенязь обвинила Литву в сознательном уклонении от диалога с Беларусью ПО ПОВОДУ Островецкой АЭС.,prep
в связи с,В СВЯЗИ С принятием настоящего закона признать его утратившим силу.,prep
в случае,"Во время проведения выборов СЕ намекал, что ма может покинуть страну В СЛУЧАЕ кризиса.",prep
в начале,В НАЧАЛЕ своего существования этот большой пергаментный документ (размером 29¾ на 24½ дюйма) был свернут для более удобного хранения.,prep
глядя на,"ГЛЯДЯ НА самоуверенного, расписавшего меня наперед, подполковника Панка, на хитренького, хоть с виду и придурковатого кандидата в депутаты, гэбэшника или стукача Красевича, я начал их побаиваться…",prep
в области,"Ей принадлежит важная роль в международном научно-техническом сотрудничестве, в том числе В ОБЛАСТИ ядерных исследований, освоении космоса и т. д.",prep
за счет,Правосудие не может вершиться ЗА СЧЕТ новых убийств.,prep
в соответствии с,Привести нормативные правовые акты правительства республики Беларусь В СООТВЕТСТВИИ С настоящим законом.,prep
не без,"Похоже, НЕ БЕЗ сожаления он протянул его солдату.",prep
судя по,"За стеклом витрин лежало оружие, будто бы принадлежавшее ему, еще некие предметы, СУДЯ ПО надписям, они тоже принадлежали Змееборцу.",prep
в пользу,"Если нынешняя администрация США будет настаивать на осуществлении провозглашенной СНБ, то шансы В ПОЛЬЗУ данной альтернативы резко повышаются.",prep
в отличие от,"В ОТЛИЧИЕ ОТ многих европейских стран, где профессия врача одна из самых высокооплачиваемых, в Беларуси стоимость часа работы медицинских работников составляет всего 4404 рубля, а это между прочим только 59 , 7 от оплаты за час работы в промышленности.",prep
в отношении,Комитет по правам человека ООН выражает серьезную озабоченность приведенными в исполнение смертными приговорами В ОТНОШЕНИИ Дмитрия Коновалова и Владислава Ковалева.,prep
на основе,Информация подготовлена НА ОСНОВЕ еженедельной регистрации потребительских цен на 153 вида товаров и услуг в 31 городе страны.,prep
в силу,"Может, В СИЛУ своей научной интуиции она не поверила в господствующую версию.",prep
по сравнению с,"В феврале зарплата увеличилась ПО СРАВНЕНИЮ С январем на 2, 9%, или на 83, 7 тыс. Рублей.",prep
по мере,"Заседания правления потребительского общества проводятся ПО МЕРЕ необходимости, но не реже одного раза в месяц.",prep
на основании,16 марта мать Ковалева направила на имя Александра Лукашенко обращение с просьбой приостановить на год исполнение смертного приговора в отношении сына НА ОСНОВАНИИ статьи 61 конституции.,prep
во имя,"За деньги там, еще за что… не ВО ИМЯ самой музыки, короче.",prep
при помощи,"Ведь не сама собой, не волшебством, не чудом, а ПРИ ПОМОЩИ кнута и пряника.",prep
с целью,Создание многофункциональных оборонительных систем С ЦЕЛЬЮ комплексного решения задач обеспечения вооруженной защиты республики Беларусь.,prep
в рамках,Действующая на сегодняшний день система оплаты труда работников здравоохранения В РАМКАХ единой тарифной ставки первого разряда все равно не дает возможности достойно оценить напряженность и ответственность очень специфичной работы медицинского работника.,prep
в числе,Газета «Советская Беларусь» в обзоре поэзии упомянула его имя В ЧИСЛЕ молодых пролетарских поэтов.,prep
в ходе,Одним из наиболее заслуживающих внимания недавних примеров этого была компания в северной Атлантике В ХОДЕ второй мировой войны.,prep
в зависимости от,"Комитетом государственной безопасности Республики Беларусь может создаваться оперативный штаб, возглавляемый представителем Комитета государственной безопасности Республики Беларусь или Министерства внутренних дел Республики Беларусь В ЗАВИСИМОСТИ ОТ того, компетенция какого органа будет преобладающей в проведении конкретной контртеррористической операции.",prep
вплоть до,"Неустойка за нарушение сроков начала выполнения работы (оказания услуги), ее этапа взыскивается за каждый день (час, если срок определен в часах) просрочки ВПЛОТЬ ДО начала выполнения работы (оказания услуги) или предъявления потребителем требований, предусмотренных пунктом 1 настоящей статьи.",prep
в глазах,"― Не бей в оглобли, Роман Константинович, ― с недосказанным В ГЛАЗАХ сказал Ростик.",prep
в процессе,Отличники боевой и политической подготовки не будут В ПРОЦЕССЕ этой подготовки устраивать тебе велосипед.,prep
в условиях,"Интенсивная распашка плодородных почв, особенно В УСЛОВИЯХ пересеченной местности и сезонного увлажнения, привела к развитию здесь процесса эрозии.",prep
на протяжении,НА ПРОТЯЖЕНИИ четырех десятилетий общество возглавлял известный географ путешественник.,prep
наряду с,"Плательщики налога ведут раздельный учет доходов и расходов по каждой проводимой лотерее, а также по иным видам деятельности осуществляемым НАРЯДУ С деятельностью по организации и проведению лотерей.",prep
в пределах,Совет министров республики Беларусь В ПРЕДЕЛАХ своих полномочий решает вопросы и несет ответственность за всестороннее удовлетворение потребностей вооруженных сил.,prep
за исключением,"Однако, Star Alliance покрывает все, ЗА ИСКЛЮЧЕНИЕМ юго-восточной части тихоокеанского региона от Cантьяго-де-Чили до Таити.",prep
независимо от,"У меня есть своя компания, которая собирается в бане каждый четверг, НЕЗАВИСИМО ОТ того, случился ли в среду потоп, или произошло землетрясение.",prep
недалеко от,"В коридоре у выхода на лестницу, НЕДАЛЕКО ОТ моей палаты, топчется милиционер.",prep
в районе,"Авианосец ""конвенция"" находился В РАЙОНЕ своего постоянного местопребывания.",prep
по окончании,ПО ОКОНЧАНИИ заседания Троцкий сразу же направился к телеграфному аппарату.,prep
в честь,Назвали октябрем. В ЧЕСТЬ десятой годовщины Великого Октября.,prep
от имени,"Кэтрин Эштон добавила, что этот посыл белорусской стороне отправляется как ОТ ИМЕНИ Евросоюза, так и от отдельных стран-членов, которые имеют контакты в Беларуси.",prep
с учетом,"Реальная заработная плата (С УЧЕТОМ роста потребительских цен на товары и услуги) в январе-феврале этого года меньшилась на 1,5%.",prep
под названием,Позже мы отыскали текст ПОД НАЗВАНИЕМ «Мгновенья» в мексиканском журнале «Плюраль».,prep
в лице,Осуществляют В ЛИЦЕ органов государственного пожарного надзора в соответствии с законодательством республики Беларусь.,prep
