expression,context,category
так же,"Январские изотермы проходят в меридиональном направлении: на северном побережье Каспия ТАК ЖЕ холодно, как и на южном – Белого моря.",adv_pred
все равно,"И сколько бы я не зарабатывал, хоть миллион, хоть сто миллионов, тебе ВСЕ РАВНО будет мало.",adv_pred
только что,"Председатель белорусского фонда культуры Владимир Гилеп презентовал в Ялте новое оригинальное издание произведений Максима Богдановича, ТОЛЬКО ЧТО выпущенное в свет фондом культуры.",adv_pred
тут же,"― В Свердловске сошла, ― сказал я первое, что в голову пришло, и ТУТ ЖЕ подумал: ""А, может, и правда, в Свердловске?..",adv_pred
до сих пор,"ДО СИХ ПОР они говорят мне: ""Какое у тебя гладкое и мускулистое тело… """,adv_pred
между тем,МЕЖДУ ТЕМ министр иностранных дел Литвы Аудронюс Ажубалис 9 марта во время неформальной встречи глав МИД стран Евросоюза в Копенгагене призвал ЕС придерживаться единой позиции в вопросе строительства Островецкой и Калининградской атомных электростанций.,adv_pred
в сторону,"Капитан между тем шевельнул упрямым подбородком, показывая куда-то В СТОРОНУ.",adv_pred
на себя,"Таким образом, многочисленные версии сошлись в неприятной находке ряда мистификаций, более полстолетия пяливших НА СЕБЯ маску оригинальных текстов.",adv_pred
все время,"Я ВСЕ ВРЕМЯ думал о тебе, день и ночь.",adv_pred
до того,"Его же старенькая мама, выйдя на пенсию, перестала признавать советскую власть вообще, которую и ДО ТОГО ненавидела, особенно за безвременную гибель мужа в тридцатые годы, разговаривала с деревенцами по-белорусски и ходила по праздникам в католический костел за отсутствием в округе униатского.",adv_pred
в результате,Сикхизм — это религия зародившаяся на индийском субконтиненте в регионе пенджаб в xv веке В РЕЗУЛЬТАТЕ сектантского раскола внутри индуизма.,adv_pred
все еще,Я ВСЕ ЕЩЕ держу бокал с шампанским.,adv_pred
на месте,"Безразлично, в какую сторону, лишь бы не сидеть НА МЕСТЕ.",adv_pred
на самом деле,"Со стороны о многом можно подумать не так, как оно есть НА САМОМ ДЕЛЕ.",adv_pred
тем не менее,"Налить? ― ТЕМ НЕ МЕНЕЕ спросил один с асимметричным, словно из двух склеенным лицом.",adv_pred
в конце концов,Я тебе кто? В КОНЦЕ КОНЦОВ я тебе муж!,adv_pred
всю жизнь,"Хотя, ты знаешь, мне иногда кажется, что я ВСЮ ЖИЗНЬ был мужиком.",adv_pred
к чему,Куда и К ЧЕМУ пришел ― его дела.,adv_pred
до конца,"Приходя по вызову к клиентам, он часто не доводил ремонтные работы ДО КОНЦА, ссылаясь на отсутствие необходимых запчастей.",adv_pred
к сожалению,"Скорее всего, СНБ забудет даже нынешняя американская администрация, но, К СОЖАЛЕНИЮ, только после того, как сделает какую-нибудь роковую глупость.",adv_pred
так вот,"ТАК ВОТ, к моменту тех коктебельских встреч в первой половине 80-х годов Евгения Завадская нашла шестьсот(!) источников, регистрировавшихся наукой как борхесова игра в обман, и она упорно продолжала кропотливую, притягательную работу.",adv_pred
в целом,В ЦЕЛОМ это важный и существенный шаг в формировании рыночной конъюнктуры 2012 года.,adv_pred
на свете,"Знаешь, Наташенька, я самая счастливая женщина НА СВЕТЕ, раз у меня есть такой муж.",adv_pred
в руки,"Богдан, возьми себя В РУКИ.",adv_pred
не раз,НЕ РАЗ видно они об этом говорили…,adv_pred
в ответ,"Ступак мямлил В ОТВЕТ, что мало в этом понимает.",adv_pred
последнее время,Ну и конечно очень популярный последнее время принт.,adv_pred
в основном,"По сообщению УКГБ, В ОСНОВНОМ в области вкладчики вносили в приобретение акций суммы до 10 тыс. долларов.",adv_pred
в прошлом,"Там, В ПРОШЛОМ, я люблю только его детство…",adv_pred
по дороге,"Я достал коньяк, который все же прихватил ПО ДОРОГЕ, разговор предполагая нервный.",adv_pred
с трудом,"Через несколько минут все кончено, рана промыта, перевязана. С ТРУДОМ слезаю со стола.",adv_pred
в душе,"А если и не переметнулся открыто, то В ДУШЕ вряд ли сочувствовал недавним руководителям района, местным активистам.",adv_pred
в свою очередь,"В СВОЮ ОЧЕРЕДЬ сотрудники УКГБ по Витебской области в ходе проведенной спецоперации изъяли более 3, 5 тыс. буклетов, около 7, 5 тыс. наклеек с логотипом этой кампании, компьютеры, ноутбуки, оргтехнику и электронные носители.",adv_pred
как всегда,"И тут же капитан в той неловкости, в которую сам себя я поставил, мне и помог, КАК ВСЕГДА помогают наивные люди.",adv_pred
в порядке,"Существует ограниченное количество разрешений, отведенных для посетителей без предварительной записи, которые доступны В ПОРЯДКЕ живой очереди.",adv_pred
во главе,"Ходят слухи, что Карл Либкнехт освобожден и скоро встанет ВО ГЛАВЕ немецкого правительства.",adv_pred
про себя,"Ступак конечно удивился и тихо порадовался ПРО СЕБЯ, что тогда ему посчастливилось неприметно вырваться из рук омоновцев.",adv_pred
ни разу,"И никому НИ РАЗУ не понадобился переводчик: то, что пропущено через сердце, понятно каждому.",adv_pred
в свое время,"В СВОЕ ВРЕМЯ, связанный семьями, проблемами их досмотра и прокорма, во всем вольному, ни от кого не зависящему Крабичу я даже завидовал.",adv_pred
в первую очередь,"Открывая новый сезон, мы стараемся учитывать В ПЕРВУЮ ОЧЕРЕДЬ пожелания наших пассажиров и планируем в соответствии с ними свои маршруты.",adv_pred
от себя,"― Я к тебе, Сущеня, ― с дурацким напряжением в голосе сказал Буров, осторожно отстраняя ОТ СЕБЯ малыша.",adv_pred
на днях,"НА ДНЯХ, как мы пришли сюда, на этот хутор, так он рвался помочь вам, когда вы на себе телегу с лесом тащили.",adv_pred
с удовольствием,В этот холодный последний день старого года я С УДОВОЛЬСТВИЕМ выпил бы стакан горячего чаю…,adv_pred
каждый раз,Я видел ее сотни раз и все равно КАЖДЫЙ РАЗ отворачиваюсь.,adv_pred
до тех пор,"Я остаюсь здесь ДО ТЕХ ПОР, пока Он не заговорит со мной.",adv_pred
на глазах,"Ждал там долго, десятка два мужчин и женщин НА ГЛАЗАХ моих встретились.",adv_pred
в последнее время,"В ПОСЛЕДНЕЕ ВРЕМЯ такая рассеянная стала, мой котеночек, такая забывчивая.",adv_pred
более или менее,"Я уже нашел БОЛЕЕ ИЛИ МЕНЕЕ подходящий грот, а тут они… напали…",adv_pred
то и дело,"ТО И ДЕЛО вздрагивая в ознобе, парень подался к костерку, возле которого в предрассветных сумерках серела одинокая тень бомжа.",adv_pred
по существу,"Впрочем, никого особенно и не искали, сразу взялись за этих четырех путейцев, хотя,  ПО СУЩЕСТВУ,  никаких конкретных улик против них и не было.",adv_pred
не только,Действующий уровень процентных ставок по-прежнему обеспечивает НЕ ТОЛЬКО надежную защиту рублевых сбережений от инфляции.,conj
так и,Повесть ТАК И осталась незавершенной.,conj
но и,НО И здесь ничего ― я просто вытерся волосами.,conj
так как,"Следует быть особенно внимательным с буквами c и g, ТАК КАК их произношение меняется в зависимости от последующей гласной.",conj
да и,Все-таки и у нас есть профессиональная этика. ДА И возможности наши не безграничны.,conj
как и,"Луна ушла из жизни в ночь двух лун. Это такое уже уникальное событие, КАК И она сама.",conj
так что,"ТАК ЧТО у нас есть что обсуждать с литовскими коллегами, для чего мы и предлагаем подписать соглашение.",conj
а также,"В этот период авиакомпания увеличивает частоту выполнения полетов, вводит традиционные сезонные рейсы, А ТАКЖЕ открывает новые направления полетов.",conj
хотя бы,"В некоторых странах или внутри магазинов определенных форматов есть ХОТЯ БЫ один, зачастую довольно простой, ресторан с доступными ценами.",conj
для того чтобы,"ДЛЯ ТОГО ЧТОБЫ демонтировать старую табличку и установить постоянный мемориал, подход к нему оградили металлопрофилем.",conj
тем более,"Пока она была маленькой, мне и самому казалось, что мы похожи, ТЕМ БОЛЕЕ при таком внешнем сходстве.",conj
хотя и,"Будучи всесторонне развитым атлетом, тигр может взбираться на деревья (ХОТЯ И не очень хорошо), плавать, прыгать на большие расстояния и тянуть с силой пяти крепких человек.",conj
если не,"Так не пойду, ЕСЛИ НЕ выгоняешь.",conj
в том числе,"С момента прибытия человека на Галапагосские острова было завезено много млекопитающих, В ТОМ ЧИСЛЕ коз, лошадей, коров, крыс, кошек и собак.",conj
как только,"Будьте уверены, КАК ТОЛЬКО вы доберетесь до причала, все станет вполне очевидно.",conj
так же как,А в средней полосе – ТАК ЖЕ КАК ячмень и овес – в качестве кормовой культуры.,conj
да еще,"Поэтому все же не скажешь, что не было в нем тогда никакой политики. Была ― ДА ЕЩЕ разноцветная.",conj
ну а,"НУ А мне, лабуху, что думать?..",conj
будто бы,"Дальнейшие поиски показали, что «мгновенья» (либо «марионетка») БУДТО БЫ принадлежит перу Надины Стейр.",conj
как ни,"КАК НИ странно, на этот раз даже Марта не пытается остановить Роберта.",conj
после того как,"Обвинение в убийстве при отягчающих обстоятельствах будет предъявлено врачу, которая работала в детской больнице Питтсбурга, Пенсильвания, ПОСЛЕ ТОГО КАК в среду ее мать нашли мертвой в багажнике ее автомобиля.",conj
что касается,"Прежде во многом, ЧТО КАСАЕТСЯ зоны, солдат полагался на бомжа, человека более здесь опытного и знающего.",conj
хоть и,"Однако, по мнению председателя профсоюза, оплата труда является ХОТЬ И наиважнейшим, но не единственным стимулом для медицинских работников.",conj
тем более что,"Рискну выразить мнение, что для стран европейского региона существует реальная угроза увеличения оттока врачей и медицинских сестер в страны Евросоюза, ТЕМ БОЛЕЕ ЧТО там существуют специальные программы найма на работу медицинских кадров из стран-соседей с помощью в адаптации, изучения языка, найма жилья.",conj
прежде чем,"Тем не менее это серьезная проблема, и ее нужно решить. Пройдет много времени, ПРЕЖДЕ ЧЕМ будут построены полезные термоядерные реакторы.",conj
и хотя,"И ХОТЯ там совсем другое было, но во грехе оно, выходит, то же самое ― во всяком случае для попов?..",conj
так чтобы,"На трибуне стояли все секретари райкома партии, рядом с первым секретарем ― его маленькая дочка, она стояла ТАК, ЧТОБЫ ее видели.",conj
а именно,"Военные времена изменяют и характер распределения рисков, которые, так сказать, социализируются, т. е. не частный капитал, А ИМЕННО государство, как бы призванное представлять публичные интересы, станет наиболее активным агентом в рыночных операциях.",conj
в том числе и,"Никакая работа не должна быть ей в тягость, В ТОМ ЧИСЛЕ И нудная, пыльная уборка, от которой болит спина и портятся руки.",conj
а между тем,"А МЕЖДУ ТЕМ, сами Колас и Купала выступали в печати с чистосердечным признанием собственной контрреволюционной деятельности.",conj
оттого что,"Проснувшись ОТТОГО, ЧТО меня тормошила Ли-Ли, я не мог понять, как она меня здесь, на трибуне, нашла.",conj
несмотря на то что,"Конкурс ничего не дал, НЕСМОТРЯ НА ТО, ЧТО в нем участвовали крупнейшие поэты — Кулешов, Танк и другие.",conj
в то время как,"Скорчившись от боли, солдат потащился в казарму, В ТО ВРЕМЯ КАК другие молча и безучастно глядели ему вслед.",conj
да ведь,"Ах, Родион Порфирьевич, ДА ВЕДЬ он младенец еще и сиротка!",conj
после чего,ПОСЛЕ ЧЕГО они с Васильком удалились спокойным шагом в сторону замка.,conj
как бы ни,"КАК БЫ НИ оправдывались и сами про себя ни думали: мы делу служим, а не власти.",conj
если и,"А ЕСЛИ И на самом деле у него нет певческого дара, ЕСЛИ И на самом деле он раб самолюбивой мечты?",conj
"до тех пор пока","Я остаюсь здесь ДО ТЕХ ПОР, ПОКА он не заговорит со мной.",conj
хоть бы,"А бычиху ХОТЬ БЫ кто упрекнул. Наоборот, восхищались, ржали все, развеселые: ну, шальная!..",conj
а то и,"Она не верит мне и думает, что ее покарают не так, как меня, А ТО И оправдают: ведь она защищалась.",conj
лишь бы,"Я готов дать ему в полтора раза больше, ЛИШЬ БЫ в кежмарке свершилось то, чего хочет господь.",conj
что до,"Но ЧТО ДО этого Ли-Ли, почему вообще ее это цепляет?..",conj
вместо того чтобы,"На старости лет, ВМЕСТО ТОГО, ЧТОБЫ забивать ""козла"" в домино или сидеть с удочкой на речке, он вынужден ремонтировать чужие машины, отбивать пальцы на кузовном ремонте.",conj
столько же,"Ребенок… ей СТОЛЬКО ЖЕ, сколько Ли-Ли. На лице Алика отразилось спокойное удивление.",conj
чем больше,"Да и думал я не так, как Крабич, а наоборот: ЧЕМ БОЛЬШЕ нормальных людей во власти, тем лучше ― они обязаны там быть.",conj
разве что,"РАЗВЕ ЧТО хитрить будет, показывая, будто ему тоскливо",conj
равно как,"РАВНО КАК и другая символика — государственная и военная, — под которой в годы сталинской тирании были уничтожены десятки миллионов ни в чем не повинных советских людей.",conj
если только,ЕСЛИ ТОЛЬКО он действительно не из голубых ― по голосу сейчас и распознаем…,conj
с тех пор как,"Сегодня ровно три месяца С ТЕХ ПОР КАК ты ― мужчина, а я ― женщина.",conj
только бы,ТОЛЬКО БЫ бедный парень умом не двинулся.,conj
может быть,"МОЖЕТ БЫТЬ, когда-нибудь я и умру.",parenth
таким образом,"ТАКИМ ОБРАЗОМ, по экспертной оценке, инфляция с начала года составила 4, 7%.",parenth
прежде всего,"ПРЕЖДЕ ВСЕГО, вера, что мы живем красиво и справедливо.",parenth
кроме того,"КРОМЕ ТОГО, по информации ГАИ, за прошедшие сутки на дорогах Беларуси было зарегистрировано 256 ДТП с материальным ущербом.",parenth
"в таком случае","В ТАКОМ СЛУЧАЕ, исполнитель может требовать от него плату за выполненную часть работы.",parenth
во всяком случае,"Через два дня поисков мне сообщили, что госпожа Стейр, будто бы родившася в Люйсвиле, штат Кентукки, и отошедшая в мир иной в 1988 году в возрасте 86 лет, вообще никогда не существовала, ВО ВСЯКОМ СЛУЧАЕ, под этим именем или литературным псевдонимом.",parenth
между прочим,"В отличие от многих европейских стран, где профессия врача одна из самых высокооплачиваемых, в Беларуси «стоимость» часа работы медицинских работников составляет всего 4404 рубля, а это, МЕЖДУ ПРОЧИМ, только 59, 7% от оплаты за час работы в промышленности.",parenth
мне кажется,"МНЕ КАЖЕТСЯ, на этот раз я дойду.",parenth
вместе с тем,"ВМЕСТЕ С ТЕМ, как сообщили на условиях анонимности европейские дипломаты, санкции не коснутся компаний Юрия Чижа, работающих со словенскими и латвийскими предприятиями.",parenth
так сказать,"– Он левой рукой нежно склоняет к себе невесту. – В годовщину Победы. ТАК СКАЗАТЬ, по семейной традиции.",parenth
можно сказать,"МОЖНО СКАЗАТЬ, ему просто повезло, если все удастся.",parenth
в сущности,"В СУЩНОСТИ, никакого особого труда или опасности в охоте нет.",parenth
слава богу,"СЛАВА БОГУ, Габриель Гарсия Маркес после интенсивного лечения и долгой реабилитации пошел немного на поправку.",parenth
как известно,"КАК ИЗВЕСТНО, пчелы нужны только для того, чтобы делать мед.",parenth
с точки зрения,"С ТОЧКИ ЗРЕНИЯ экономической политики, она ориентируется на понижение налогов ради стимулирования потребителя и внутреннего спроса, на сильный доллар.",parenth
скорее всего,"А двое из тех, что будто бы из академии были, против нас бились. СКОРЕЕ ВСЕГО, лица в штатском.",parenth
по его мнению,"ПО ЕГО МНЕНИЮ, у нас на подобные темы пишут мало и неинтересно.",parenth
одним словом,"ОДНИМ СЛОВОМ, под Минском, есть специальная больница, где раньше умирали вот такие обреченные…",parenth
